source,author,title,description,url,urlToImage,publishedAt,content,Sentiment
"{'id': None, 'name': 'PCWorld'}",Michael Crider,"Dell’s 27-inch 1440p IPS monitor is terrific, especially for $160","While Dell makes some big, bombastic gaming displays and top-of-the-line monitors for creative pros, most people I know look to Dell for affordable and solid screens. Today’s deal delivers on that, with a 27-inch monitor and a high-quality IPS panel for just …",https://www.pcworld.com/article/2592202/dell-27-inch-1440p-ips-monitor-is-terrific-especially-for-160.html,https://www.pcworld.com/wp-content/uploads/2025/01/Dell-27-inch-monitor.jpg?quality=50&strip=all&w=1024,2025-01-29T17:07:44Z,"Skip to contentType your search and hit enter
When you purchase through links in our articles, we may earn a small commission. This doesn't affect our editorial independence
.
While Dell makes som… [+1697 chars]",0.0
"{'id': None, 'name': 'Hdblog.it'}",HDblog.it,"Qualcomm, l'inferenza on-device guiderà il futuro dellintelligenza artificiale",Qualcomm analizza levoluzione dellintelligenza artificiale,https://www.hdblog.it/qualcomm/articoli/n608644/qualcomm-inferenza-on-device-intelligenza/,https://hd2.tudocdn.net/1232392?w=1920,2025-02-12T10:55:00Z,"Qualcomm ha pubblicato un whitepaper che analizza l’evoluzione dell’intelligenza artificiale, con un focus particolare sull’inferenza on-device, ovvero la capacità di eseguire modelli AI direttamente… [+5359 chars]",0.34
"{'id': 'business-insider', 'name': 'Business Insider'}","Bianca Chan,Emmalyse Brownstein",Jamie Dimon says to quit if you don't like his RTO demands. Some of his tech workers might do just that.,The rollout of JPMorgan's RTO mandate has some tech employees are considering job offers or teaming up to influence work policy.,https://www.businessinsider.com/jpmorgan-return-to-office-mandate-tech-talent-2025-2,https://i.insider.com/67b8b4b26630eb10385d3edb?width=1200&format=jpeg,2025-02-25T17:46:19Z,"Getty Images; Jenny Chang-Rodriguez/BI
<ul><li>JPMorgan Chase has spent billions to become a technology-driven bank.</li><li>Now, due to the bank's RTO stance, some of its tech workers are consideri… [+11548 chars]",0.0
"{'id': None, 'name': 'Genbeta.com'}",Bárbara Bécares,Prefirió ganar menos dinero que ir todos los días a una oficina: esta ingeniera senior cuenta su experiencia,"Hay investigaciones y estudios que han descubierto que hay empresas que han decidido pagar menos a la gente que decide trabajar desde casa y que hay trabajadores que también aceptarían un sueldo más bajo a cambio de tener cierta flexibilidad laboral.
<!-- BRE…",https://www.genbeta.com/a-fondo/prefirio-ganar-dinero-que-ir-todos-dias-a-oficina-esta-ingeniera-senior-cuenta-su-experiencia,https://i.blogs.es/e9e268/christin-hume-hcfwew744z4-unsplash/840_560.jpeg,2025-02-21T14:17:57Z,Hay investigaciones y estudios que han descubierto que hay empresas que han decidido pagar menos a la gente que decide trabajar desde casa y que hay trabajadores que también aceptarían un sueldo más … [+2252 chars],0.0
"{'id': None, 'name': 'Impress.co.jp'}",劉 尭,デル、Lunar Lake搭載の14型/16型ノート,デル・テクノロジーズは、CPUにLunar LakeことCore Ultraシリーズ2を搭載したCopilot+ PC準拠ノートPCおよび2in1を発売した。,https://pc.watch.impress.co.jp/docs/news/1663788.html,https://pc.watch.impress.co.jp/img/pcw/list/1663/788/1.jpg,2025-02-18T08:30:49Z,"CPULunar LakeCore Ultra2Copilot+ PCPC2in1 
Dell 14 Plus(DB14250)
 Dell 14 Plus(DB14250)2,560×1,60014 
 Core Ultra 5 226V16GB1TB SSD179,000Core Ultra 9 288V32GB1TB SSD269,000 
 Thunderbolt 4USB 3.… [+649 chars]",0.0
"{'id': None, 'name': 'Impress.co.jp'}",劉 尭,Lunar Lake搭載の「Dell Pro 13 Plus」が販売開始,デル・テクノロジーズは、Lunar LakeことCore Ultra 200Vシリーズを搭載したビジネスモバイルノート「Dell Pro 13 Plus」を販売開始した。,https://pc.watch.impress.co.jp/docs/news/1666013.html,https://pc.watch.impress.co.jp/img/pcw/list/1666/013/1.jpg,2025-02-27T02:04:18Z,"Lunar LakeCore Ultra 200VDell Pro 13 Plus 
 1/16:10USB Type-C 
 Core Ultra 5 236V16GB512GB SSD1,920×1,20013OSWindows 11 Pro212,129 
 Thunderbolt 4 2USB 3.2 Gen 1 2HDMI 2.1 1WebWi-Fi 7Bluetooth 5.4… [+34 chars]",0.0
"{'id': None, 'name': 'Hdblog.it'}",HDblog.it,"Le TOP 5 offerte di oggi: monitor, notebook, telecamere di sicurezza e altro",Ecco le migliori offerte Amazon ed eBay dell'11 febbraio.,https://www.hdblog.it/ebay/offerte/n608557/migliori-offerte-oggi-11-febbraio-2025/,https://hd2.tudocdn.net/1112711?w=1920,2025-02-11T16:20:00Z,L'appuntamento quotidiano con le migliori offerte tech torna con una selezione aggiornata delle promozioni più interessanti disponibili su Amazon ed eBay. L'elenco di oggi include sconti su accessori… [+835 chars],0.1779
"{'id': None, 'name': 'Tomshw.it'}",Dario De Vita,Cosa offre CyberGhost VPN per soli 2€ al mese? Tutto quello che ti serve,"Nel panorama delle reti private virtuali, CyberGhost si distingue per l'equilibrio tra prestazioni elevate e convenienza economica. Attualmente, l’azienda offre uno sconto dell’82% sul suo...",https://www.tomshw.it/hardware/cosa-offre-cyberghost-vpn-per-soli-2eur-al-mese-tutto-quello-che-ti-serve,https://www.tomshw.it/storage/media/2024/08/31605/CyberGhost-82--copertina.jpg,2025-02-06T08:03:19Z,"Nel panorama delle reti private virtuali, CyberGhost si distingue per l'equilibrio tra prestazioni elevate e convenienza economica. Attualmente, l’azienda offre uno sconto dell’82% sul suo piano a lu… [+1467 chars]",0.0
"{'id': 'business-insider', 'name': 'Business Insider'}",Jamie Heller,Tech execs send signals about where their companies are headed,"In this Sunday edition of Business Insider Today, we're taking you through all the major changes Big Tech companies made to the workplace this week.",https://www.businessinsider.com/bi-today-big-tech-companies-major-changes-2025-2,https://i.insider.com/67327b635ec9bfa3d63d649c?width=1200&format=jpeg,2025-02-02T11:38:01Z,"Ranta Images/Getty, Tyler Le/BI
<ul><li>This post originally appeared in the BI Today newsletter.</li><li>You can sign up for Business Insider's daily newsletter here.</li></ul>Welcome back to our S… [+6685 chars]",0.0
"{'id': 'business-insider', 'name': 'Business Insider'}",Lara O'Reilly,Elon Musk's X is winning advertisers new and old — but the comeback has a long way to go,"X's pool of advertisers is growing, but it's far from recouping the revenue lost in the ad exodus following Musk's 2022 takeover.",https://www.businessinsider.com/elon-musk-x-advertising-spending-data-analysis-mixed-recovery-2025-2,https://i.insider.com/67a510347bb3f854015c1151?width=1200&format=jpeg,2025-02-14T09:25:01Z,"Elon Musk's X is drawing new advertisers and welcoming back some that pulled spending, but the overall picture of its business is complicated.Marc Piasecki/Getty Images
<ul><li>X is attracting new a… [+6037 chars]",0.7269
"{'id': None, 'name': 'Slickdeals.net'}",Dr.Wajahat,"Dell G16 Gaming Laptop: i9-13900HX, 16"" QHD+ 240Hz, 1TB SSD, 32GB RAM, RTX 4070 $1300 or Less + Free Shipping",$1170 $1899.99 after the following steps:Click here [dell.com] to Subscribe to emails for unique 10% off codeCheck your inbox or spam folder for email w/ coupon code; may take 30 minutes or more to ar,https://slickdeals.net/f/18124432-dell-g16-7630-16-qhd-240hz-i9-13900hx-rtx-4070-32gb-ddr5-1tb-ssd-w-sign-up-code-1170-99?utm_source=rss&utm_content=fp&utm_medium=RSS2,https://slickdeals.net/attachment/3/5/9/4/0/2/8/450x450/17107636.thumb,2025-02-18T02:23:52Z,"This collaborative space allows users to contribute additional information, tips, and insights to enhance the original deal post. Feel free to share your knowledge and help fellow shoppers make infor… [+26 chars]",0.8591
"{'id': None, 'name': 'Slickdeals.net'}",Dr.Wajahat,"Dell Inspiron 15: 15.6"" FHD 120Hz IPS, Ryzen 3 7320U, 8GB LPDDR5, 512GB SSD $250 (or Less) + Free Shipping",$224.99 $379.99 after the following steps:Click here [dell.com] to Subscribe to emails for unique 10% off codeCheck your inbox or spam folder for email w/ coupon code; may take 30 minutes or more to a,https://slickdeals.net/f/18121525-dell-inspiron-15-15-6-fhd-120hz-ips-ryzen-3-7320u-8gb-lpddr5-512gb-ssd-250-or-less-free-shipping?utm_source=rss&utm_content=fp&utm_medium=RSS2,https://slickdeals.net/attachment/2/6/8/0/6/1/2/1/450x450/17097430.thumb,2025-02-15T18:09:02Z,"This collaborative space allows users to contribute additional information, tips, and insights to enhance the original deal post. Feel free to share your knowledge and help fellow shoppers make infor… [+26 chars]",0.8591
"{'id': None, 'name': 'Ascii.jp'}",ASCII,デルから4KUHD対応でIPS Blackパネル搭載の27型＆32型ディスプレー発売,デル・テクノロジーズは、IPS Blackを搭載した27型ディスプレー「Dellデジタル ハイエンド シリーズ27 4K Thunderboltハブ モニター - U2725QE」＆32型ディスプレー「Dellデジタル ハイエンド シリーズ32 4K Thunderboltハブ モニター - U3225QE」を販売開始した。,https://weekly.ascii.jp/elem/000/004/253/4253914/,https://ascii.jp/img/2025/02/27/4169087/l/e1f2c1c70935ac33.png,2025-02-27T04:30:00Z,"Dell 27 4K Thunderbolt - U2725QE
226IPS Black27Dell 27 4K Thunderbolt - U2725QE32Dell 32 4K Thunderbolt - U3225QE
DellIPS Black2732
4KUHD3840×2160120HzIPS4730001
Dell 32 4K Thunderbolt - U3225QE… [+110 chars]",0.0
"{'id': None, 'name': 'Hdblog.it'}",HDblog.it,"Apple, dura critica alle leggi UE dopo larrivo della prima app porno su iPhone",Apple ha duramente criticato il Digital Markets Act (DMA) dellUnione Europea,https://www.hdblog.it/smartphone/articoli/n607644/apple-critica-leggi-ue-app-porno/,https://hd2.tudocdn.net/1229603?w=1920,2025-02-04T06:02:00Z,"Apple ha duramente criticato ilDigital Markets Act (DMA) dell’UE dopo che la prima app pornografica per iPhone è stata resa disponibile sui dispositivi dell’azienda in Europa. L’app in questione, Hot… [+2507 chars]",0.34
"{'id': None, 'name': 'Hdblog.it'}",HDblog.it,"Deepseek, l'AI a basso costo spinge alla ""commoditizzazione"" dei modelli","Matt Calkins, Fondatore, CEO e Presidente di Appian lancia la commoditizzazione dellAI",https://www.hdblog.it/business/articoli/n608373/appian-futuro-ai-deepseek/,https://hd2.tudocdn.net/1231596?w=1920,2025-02-11T11:20:00Z,"L'annuncio di DeepSeek ha scosso il settore e sollevato interrogativi sul futuro del panorama dell'AI. Un approccio ""magico"" con meno risorse: DeepSeek sembra sfidare le aspettative, raggiungendo pre… [+1944 chars]",0.34
"{'id': None, 'name': 'Tomshw.it'}",Luca Zaninello,"PassMark: dopo 20 anni di crescita, calo storico nelle prestazioni delle CPU","PassMark Software, azienda impegnata nello sviluppo di strumenti di benchmarking e diagnostica per PC dal 1998, ha pubblicato dati che indicano un'inversione di tendenza storica nelle prestazioni dell...",https://www.tomshw.it/hardware/passmark-dopo-20-anni-di-crescita-calo-storico-nelle-prestazioni-delle-cpu-2025-02-13,https://www.tomshw.it/storage/media/2024/10/38207/CPU-Cover.webp,2025-02-13T09:28:04Z,"PassMark Software, azienda impegnata nello sviluppo di strumenti di benchmarking e diagnostica per PC dal 1998, ha pubblicato dati che indicano un'inversione di tendenza storica nelle prestazioni del… [+3923 chars]",0.34
"{'id': None, 'name': 'Hdblog.it'}",HDblog.it,"Primo Rapporto sulle agroenergie di Confagricoltura, opportunità e prospettive","Disponibile primo rapporto dellOsservatorio sulle Agroenergie di Confagricoltura, realizzato con il sostegno di Enel.",https://www.hdblog.it/green/articoli/n608802/rinnovabili-primo-rapporto-agroenergie/,https://hd2.tudocdn.net/1196434?w=1920,2025-02-13T14:25:00Z,"Nonostante i ritardi riguardanti le linee guida dei carbon credits, il settore agricolo si conferma un protagonista di rilievo nella transizione energetica italiana, anche grazie al suo potenziale co… [+5168 chars]",0.3612
"{'id': None, 'name': 'Tomshw.it'}",Dario De Vita,Le migliori uova di Pasqua 2025,"Le uova di Pasqua rappresentano una tradizione irrinunciabile per milioni di persone, un dolce simbolo delle festività primaverili. Con l’avvicinarsi della Pasqua 2025, la ricerca dell&rs...",https://www.tomshw.it/altro/migliori-uova-di-pasqua,https://www.tomshw.it/storage/media/2025/02/49981/Le-migliori-uova-di-Pasqua-2025-copertina.jpg,2025-02-24T16:52:07Z,"Le uova di Pasqua rappresentano una tradizione irrinunciabile per milioni di persone, un dolce simbolo delle festività primaverili. Con l’avvicinarsi della Pasqua 2025, la ricerca dell’uovo perfetto … [+5165 chars]",0.0
"{'id': 'il-sole-24-ore', 'name': 'Il Sole 24 Ore'}",di Andrea Biondi e Francesco Prisco,"Sanremo 2025, raccolta pubblicitaria a 65,2 milioni. Finale con 13,4 milioni di ascolti e 73,1% di share","Rai Pubblicità: incremento dell’8,5% sui ricavi dell’anno scorso. L’Auditel aggiorna i record, intanto Conti «promette» il Festival Carlo V",https://www.ilsole24ore.com/art/sanremo-2025-finale-134-milioni-ascolti-e-731percento-share-AGcfvmvC,https://i2.res.24o.it/images2010/S24/Documenti/2025/02/17/Immagini/Ritagli/LP_23132188-U33831544002swt-1440x752@IlSole24Ore-Web.jpg?r=1170x507,2025-02-16T09:09:00Z,"Ascolta la versione audio dell'articolo
3' di lettura
Fare meglio, in termini di ricavi e ascolti, rispetto al quinquennio di Amadeus era difficile. Eppure è successo: la raccolta pubblicitaria leg… [+2841 chars]",0.0
"{'id': None, 'name': 'Quartz India'}",Vinamrata Chaturvedi,"Nvidia, Salesforce, Hims & Hers, and more stocks to watch this week","After a brief and relatively quiet week for earnings, this week promises to bring a wave of significant reports, offering valuable insights into the future trajectory of key sectors such as AI, technology, and finance.Read more...",https://qz.com/nvidia-salesforce-hims-hers-stock-earnings-1851765863,"https://i.kinja-img.com/image/upload/c_fill,h_675,pg_1,q_80,w_1200/f5b0df6c35143820f516a0c0c96f8d5e.jpg",2025-02-23T10:00:00Z,"In This Story
After a brief and relatively quiet week for earnings, this week promises to bring a wave of significant reports, offering valuable insights into the future trajectory of key sectors su… [+2210 chars]",0.7579
"{'id': None, 'name': 'Tecnoblog.net'}",Emerson Alecrim,Dell lança no Brasil headset wireless com IA por R$ 3.500,"Headset Dell Premier WL7024 tem tecnologia de cancelamento de ruído auxiliada por inteligência artificial e até 80 horas de bateria
Dell lança no Brasil headset wireless com IA por R$ 3.500",https://tecnoblog.net/noticias/dell-lanca-no-brasil-headset-wireless-com-ia-por-r-3-500/,https://files.tecnoblog.net/wp-content/uploads/2025/01/headset-dell-premier-ia.jpg,2025-01-27T21:08:04Z,"Mais conhecida por produzir computadores, a Dell também desenvolve uma variedade de acessórios. Entre eles está o headset Dell Premier WL7024. O modelo conta com cancelamento de ruído auxiliado por i… [+2340 chars]",0.0
"{'id': None, 'name': 'Tomshw.it'}",Dario De Vita,"Con gli sconti Dell, scegliere la tecnologia giusta è una certezza",Acquistare il prodotto giusto potrebbe non essere mai stato così semplice grazie agli sconti Dell disponibili oggi su Amazon. Chi è alla ricerca di monitor e PC affidabili e prestazional...,https://www.tomshw.it/hardware/con-gli-sconti-dell-scegliere-la-tecnologia-giusta-e-una-certezza,"https://www.tomshw.it/storage/media/2025/02/48795/Con-gli-sconti-Dell,-scegliere-la-tecnologia-giusta-è-una-certezza.jpg",2025-02-11T10:42:27Z,Acquistare il prodotto giusto potrebbe non essere mai stato così semplice grazie agli sconti Dell disponibili oggi su Amazon. Chi è alla ricerca di monitor e PC affidabili e prestazionali può approfi… [+1817 chars],0.1779
"{'id': None, 'name': 'Hdblog.it'}",HDblog.it,"Nuova partnership per un'aria più pulita, ENEA e E-roundme sviluppano ISMuSe",A supporto del monitoraggio della qualità dellaria interviene un nuovo partenariato tra ENEA e la start-up E-roundme.,https://www.hdblog.it/green/articoli/n608891/enea-e-roundme-strumento-qualita-aria-ismuse/,https://hd2.tudocdn.net/1232969?w=1920,2025-02-14T11:55:00Z,"La presenza di agenti inquinanti nell’aria è un rischio per la salute umana e per l’ambiente. In particolare, il particolato fine può colpire l’apparato respiratorio e provocare malattie croniche e d… [+3025 chars]",0.2023
"{'id': None, 'name': 'Forbes'}","Trefis Team, Contributor, 
 Trefis Team, Contributor
 https://www.forbes.com/sites/greatspeculations/people/trefis/",Why Dell Technologies Stock Is Down 9% In A Day?,"Nvidia’s stock (NASDAQ: NVDA) also felt the ripple effect, and plummeted 17% on the same day.",https://www.forbes.com/sites/greatspeculations/2025/01/28/why-dell-technologies-stock-is-down-9-in-a-day/,https://imageio.forbes.com/specials-images/imageserve/6798f0e74639f6f6a32d0397/0x0.jpg?format=jpg&height=900&width=1600&fit=bounds,2025-01-28T15:01:18Z,"POLAND - 2025/01/11: In this photo illustration, a Dell logo seen displayed on a smartphone. (Photo ... [+] Illustration by Mateusz Slodkowski/SOPA Images/LightRocket via Getty Images)
SOPA Images/L… [+4118 chars]",0.0
"{'id': None, 'name': 'Hdmotori.it'}",HDblog.it,Industria automobilistica europea: innovazione bloccata dalla burocrazia?,Linnovazione dellauto in Europa è minacciata da regole rigide. Leader del settore chiedono meno burocrazia e più incentivi.,https://www.hdmotori.it/auto/articoli/n609270/industria-automobilistica-europea-futuro/,https://hd2.tudocdn.net/1233948?w=1920,2025-02-18T14:30:00Z,"Da oltre un secolo, l’industria automobilistica europea è sinonimo di eccellenza tecnologica e innovazione. Case automobilistiche e fornitori di componentistica hanno costantemente guidato il progres… [+2228 chars]",0.0
"{'id': None, 'name': 'Tomshw.it'}",Dario De Vita,Ultime ore per la promo Internxt: 85% e zaino Swiss Peak in omaggio,Sta per concludersi la promozione di Internxt dedicata all'ormai trascorsa settimana di San Valentino. Chi desidera ottenere uno sconto dell’85% su tutti i piani di cloud storage a vita ha solo...,https://www.tomshw.it/hardware/ultime-ore-per-la-promo-internxt-85-e-zaino-swiss-peak-in-omaggio,https://www.tomshw.it/storage/media/2025/02/49917/Ultime-ore-per-la-promo-Internxt-copertina.jpg,2025-02-24T12:52:50Z,Sta per concludersi la promozione di Internxt dedicata all'ormai trascorsa settimana di San Valentino. Chi desidera ottenere uno sconto dell’85% su tutti i piani di cloud storage a vita ha solo poche… [+1994 chars],0.34
"{'id': None, 'name': 'Tomshw.it'}",Antonello Buzzi,"Questo notebook Dell è leggero, potente e intelligente! Oggi in OFFERTA! - 14%","Se state cercando un notebook potente e versatile, questa offerta su Amazon potrebbe fare al caso vostro. Il Dell Inspiron 14 Plus è ora disponibile a soli 899€, con un interessante sconto...",https://www.tomshw.it/hardware/questo-notebook-dell-e-leggero-potente-e-intelligente-oggi-in-offerta,https://www.tomshw.it/storage/media/2025/02/48779/Dell-Inspiron-14-Plus-offerta-11022025-copertina.png,2025-02-11T09:54:45Z,"Se state cercando un notebook potente e versatile, questa offerta su Amazon potrebbe fare al caso vostro. Il Dell Inspiron 14 Plus è ora disponibile a soli 899€, con un interessante sconto del 14% ri… [+2069 chars]",0.1779
"{'id': None, 'name': 'Tomshw.it'}",Antonello Buzzi,"Migliora la tua produttività con questo monitor Dell, oggi a SOLI 187€!","Se state cercando un monitor di qualità per il vostro ufficio o la vostra postazione di lavoro, non potete perdere questa offerta su Amazon. Infatti, Dell P2725H, un monitor da 27 pollici Full...",https://www.tomshw.it/hardware/migliora-la-tua-produttivita-con-questo-monitor-dell-oggi-a-soli-187-eur,https://www.tomshw.it/storage/media/2025/02/49188/Dell-P2725H-offerta-17022025-copertina.png,2025-02-17T09:29:26Z,"Se state cercando un monitor di qualità per il vostro ufficio o la vostra postazione di lavoro, non potete perdere questa offerta su Amazon. Infatti, Dell P2725H, un monitor da 27 pollici Full HD, è … [+1745 chars]",0.1779
"{'id': None, 'name': 'Tomshw.it'}",Antonello Buzzi,"SCONTO del 21% su questo laptop potente e versatile, tuo a SOLI 449€!","Se state cercando un notebook affidabile e performante a un prezzo conveniente, l'occasione giusta è su Amazon. Infatti, il computer portatile Dell Inspiron 15 3520 è disponibile a soli...",https://www.tomshw.it/hardware/sconto-del-21-su-questo-laptop-potente-e-versatile-tuo-a-soli-449-eur,https://www.tomshw.it/storage/media/2025/02/49164/Dell-Inspiron-15-3520-offerta-17022025-copertina.png,2025-02-17T08:07:12Z,"Se state cercando un notebook affidabile e performante a un prezzo conveniente, l'occasione giusta è su Amazon. Infatti, il computer portatile Dell Inspiron 15 3520 è disponibile a soli 449€, con uno… [+1800 chars]",0.1779
"{'id': None, 'name': 'Tomshw.it'}",Antonello Buzzi,"Elimina i punti morti in casa con questo router ASUS, oggi al MINIMO STORICO!","Se state cercando un router LTE avanzato per migliorare la vostra connessione internet, ASUS 4G-AC86U è disponibile su Amazon a soli 149,90€, con uno sconto dell'8% rispetto al prezzo medi...",https://www.tomshw.it/hardware/elimina-i-punti-morti-in-casa-con-questo-router-asus-oggi-al-minimo-storico,https://www.tomshw.it/storage/media/2025/02/48887/ASUS-4G-AC86U-offerta-12022025-copertina.png,2025-02-12T09:37:04Z,"Se state cercando un router LTE avanzato per migliorare la vostra connessione internet, ASUS 4G-AC86U è disponibile su Amazon a soli 149,90€, con uno sconto dell'8% rispetto al prezzo mediano di 163€… [+2143 chars]",0.1779
"{'id': None, 'name': 'Unixdigest.com'}",,Hypocrisy and politics in free and open source software projects,Comments,https://unixdigest.com/articles/hypocrisy-and-politics-in-free-and-open-source-software-projects.html,,2025-02-01T04:02:12Z,"Published on 2025-01-31.
At EuroBSDCon 2024, Kim McMahon, who is a so-called expert in product-led growth strategies, developer marketing, open source marketing, and growing healthy and productive c… [+2429 chars]",0.7184
"{'id': None, 'name': 'Hdmotori.it'}",HDblog.it,Green NCAP 2024: ecco le auto più ecologiche dellanno,Le auto più ecologiche del 2024 secondo Green NCAP,https://www.hdmotori.it/honda/articoli/n608394/green-ncap-auto-ecologiche-2024/,https://hd2.tudocdn.net/1123404?w=1920,2025-02-10T16:15:00Z,"Green NCAP, iniziativa indipendente di Euro NCAP dedicata alla promozione di veicoli più puliti ed efficienti dal punto di vista energetico, ha annunciato i vincitori delle categorie Top per il 2024.… [+2102 chars]",0.4939
"{'id': None, 'name': 'Forbes'}","Anshel Sag, Contributor, 
 Anshel Sag, Contributor
 https://www.forbes.com/sites/moorinsights/people/anshelsag/","Dell CES 2025: New Gear, New Branding And The Return Of Area-51","Dell made a slew of announcements at CES 2025 to revamp its PC offerings, extend its software and services and reintroduce the Area-51 sub-brand of Alienware.",https://www.forbes.com/sites/moorinsights/2025/02/05/dell-ces-2025-new-gear-new-branding-and-the-return-of-area-51/,https://imageio.forbes.com/specials-images/imageserve/67a3a3241d26dca7a9033697/0x0.jpg?format=jpg&height=900&width=1600&fit=bounds,2025-02-05T17:54:41Z,"Dells new Alienware Area-51 laptop
Dell
The year got off to a big start for Dell at CES 2025 with a slew of major announcements. I got the chance to have hands-on previews of many of Dells new prod… [+14663 chars]",0.25
"{'id': None, 'name': 'Neatorama.com'}",John Farrier,"Whale Swallows Kayaker, Then Spits Him Out","There's a special kind of terror that a parent feels when they see their child in sudden mortal danger.It is never far from your thoughts.The Guardian reports that Adrián Simancas and his father, Dell, were kayaking in the Bahía El Águila in the Strait of Mag…",https://www.neatorama.com/2025/02/14/Whale-Swallows-Kayaker-Then-Spits-Him-Out/,,2025-02-14T14:03:45Z,"There's a special kind of terror that a parent feels when they see their child in sudden mortal danger.
It is never far from your thoughts.
The Guardian reports that Adrián Simancas and his father,… [+398 chars]",-0.6249
"{'id': None, 'name': 'VentureBeat'}",Dean Takahashi,Intel launches Xeon 6 processors with performance cores for 2X AI processing,"Join our daily and weekly newsletters for the latest updates and exclusive content on industry-leading AI coverage. Learn More Intel is launching its new Intel Xeon 6 processors with performance-cores, offering better performance across data center workloads …",https://venturebeat.com/games/intel-launches-xeon-6-processors-with-performance-cores-for-2x-ai-processing/,https://venturebeat.com/wp-content/uploads/2025/02/Intel-Xeon-6-SoC-2.jpg?w=1024?w=1200&strip=all,2025-02-24T16:00:00Z,"Join our daily and weekly newsletters for the latest updates and exclusive content on industry-leading AI coverage. Learn More
Intel is launching its new Intel Xeon 6 processors with performance-cor… [+6947 chars]",0.4019
